{
  "schemaVersion": 2,
  "sample": false,
  "lastUpdated": "2026-10-23T19:53:11+07:00",
  "lastMode": "append",
  "timezone": "Asia/Ho_Chi_Minh",
  "startDate": "2026-06-11",
  "sources": {
    "doji": {
      "status": "ok",
      "lastSuccess": "2026-10-23T19:53:05+07:00",
      "source": "giavang24k",
      "message": "range=7d: added 1 day(s) (2026-10-23 → 2026-10-23)"
    },
    "xau": {
      "status": "ok",
      "lastSuccess": "2026-10-23T19:53:09+07:00",
      "source": "yahoo:GC=F",
      "message": "yahoo:GC=F: added 1 day(s) (2026-10-22 → 2026-10-22)"
    },
    "fx": {
      "status": "ok",
      "lastSuccess": "2026-10-23T19:53:11+07:00",
      "message": "added 1/1 missing day(s)"
    }
  },
  "counts": {
    "doji": 129,
    "xau": 93,
    "fx": 135,
    "converted": 135
  }
}
